url;name;author;difficulty;image;videoContentUrl;calories;totalTime;recipeYield;estimatedCost;ratingValue;reviewCount;ingredients;categoryTags
https://www.recetasderechupete.com/sarmale-o-rollitos-de-carne-con-hojas-de-repollo-receta-tipica-rumana/9205/;Sarmale o Rollitos de carne con hojas de repollo. Receta típica rumana;Alfonso López;Dificultad media;https://www.recetasderechupete.com/wp-content/uploads/2014/01/sarmale_rollitos_repollo.jpg;;Calorías por 100g: 305kcal;180 min.;8 pers.;Precio: 1.3 €/persona;3.7;74;[<li>1 kg. y medio de hojas de col o repollo</li>, <li>1 kg. de carne picada de cerdo mezclada con carne de ternera. Mitad de cada.</li>, <li>2 cebollas grandes y 2 pimientos rojos</li>, <li>100 g. de arroz redondo SOS</li>, <li>300 g. de bacon o panceta ahumada</li>, <li>5 cucharas de salsa de tomate frito</li>, <li>150 ml. de aceite de oliva virgen extra</li>, <li>2 hojas de laurel, una cucharadita tipo postre de eneldo seco, pimienta negra recién molida (media cucharadita tipo postre) y sal (esta última al gusto).</li>, <li>1 rebanada de pan</li>, <li>El zumo de un limón</li>, <li>1 cucharita de cimbru (especie típica rumana), sino lo encontráis lo podéis sustituir por tomillo picado.</li>];['Recetas con arroz blanco', 'Recetas con arroz bomba', 'Recetas con cerdo', 'Recetas con pollo', 'Recetas con ternera', 'Recetas de arroz', 'Recetas de carne para navidad', 'Recetas de carne picada', 'Recetas de carnes y aves', 'Recetas de ensaladas y verduras', 'Recetas para ocasiones especiales']
https://www.recetasderechupete.com/alitas-de-pollo-crujientes-al-horno/8731/;Alitas de pollo crujientes al horno;Alfonso López;Superfácil;https://www.recetasderechupete.com/wp-content/uploads/2013/12/alitas_pollo_crujientes.jpg;;Recetas con pollo · Recetas de carne al horno · Recetas de carnes y aves · Recetas de tapas y aperitivos;30 min.;4 pers.;Precio: 1.8 €/persona;3.6;33;[<li>12 alitas de pollo</li>, <li>2 huevos</li>, <li>150 ml de leche entera (10 cucharadas)</li>, <li>2 cucharaditas de pimentón dulce o picante</li>, <li>Pimienta negra recién molida y sal (al gusto)</li>, <li>100 g. de mantequilla</li>, <li>150 g. de harina de trigo</li>, <li>400 g. de pan rallado (tipo crujiente)</li>];[]
https://www.recetasderechupete.com/empanada-gallega-de-pollo-y-mousse-de-foie-receta-paso-a-paso/4965/;Empanada de pollo;Alfonso López;Difícil;https://www.recetasderechupete.com/wp-content/uploads/2012/02/empanada_pollo_champinhones.jpg;;Recetas con pollo · Recetas de carnes y aves · Recetas de pan, masas y rebozados;90 min.;8 pers.;Precio: 1.8 €/persona;3;1;[<li>3 cebollas, Aceite de oliva extra (6 cucharadas)</li>, <li>2 pechugas de pollo hermosas, 100 g de uvas pasas sin pepitas, 4 cucharas de salsa de soja, 2 cucharadas grandes de miel, una pizca de canela molida.</li>, <li>50 g de mousse de foie y 150 g de champiñones o setas de temporada.</li>, <li>Sal y pimienta negra recién molida (al gusto)</li>, <li>Masa de empanada gallega: 200 ml de agua tibia, 600 g de harina de trigo de fuerza para panadería, 2 pellizcos de Sal, 8 cucharadas del aceite de oliva virgen extra y 40 g de levadura prensada de panadería o 15 g de levadura en polvo de panadería.</li>];[]
https://www.recetasderechupete.com/receta-de-pollo-relleno-de-mousse-de-foie-con-setas/1099/;Pollo relleno de foie con setas;Alfonso López;Dificultad media;https://www.recetasderechupete.com/wp-content/uploads/2009/12/pollo_mousse_foie.jpg;;Calorías por 100g: 305kcal;120 min.;8 pers.;Precio: 3.55 €/persona;4.1;9;[<li>6 filetes grandes de pechuga de pollo</li>, <li>300 g de setas</li>, <li>1 bote pequeño de foie o paté de setas</li>, <li>350 ml de vino de Oporto</li>, <li>100 ml de vinagre de Módena</li>, <li>2 rebanadas de pan tostado</li>, <li>4 cebollas medianas</li>, <li>Sal y pimienta negra recién molida (al gusto)</li>, <li>6 dientes de ajo</li>, <li>Romero, tomillo y 50 g de piñones</li>, <li>200 ml de aceite de oliva virgen extra</li>, <li>1 cucharada de pimentón dulce</li>, <li>3 cucharadas de miel</li>, <li>2 lonchas de jamón serrano</li>];['Recetas con pollo', 'Recetas de carne para navidad', 'Recetas de carnes y aves', 'Recetas para ocasiones especiales']
https://www.recetasderechupete.com/receta-de-crepes-rellenos-de-pollo-con-mousse-de-foie-chef-serrano/1112/;Crepes rellenos de pollo;Alfonso López;Dificultad media;https://www.recetasderechupete.com/wp-content/uploads/2009/12/crepes_rellenos.jpg;;Recetas con pollo · Recetas de carnes y aves · Recetas de pan, masas y rebozados;60 min.;6 pers.;Precio: 1.6 €/persona;3.4;16;[<li>2 pechugas de pollo fileteada (Relleno)</li>, <li>100 ml de Caldo de pollo o leche (Relleno)</li>, <li>1 mousse de foie de pato o Foie (Relleno)</li>, <li>Sal y pimienta (al gusto)</li>, <li>1 huevo (Crêpes)</li>, <li>1 vaso de leche entera (Crêpes)</li>, <li>1 pizca de sal (Crêpes)</li>, <li>10 g de mantequilla (Crêpes)</li>, <li>1/2 l de Bechamel</li>, <li>150 g de harina (Crêpes)</li>, <li>Queso rallado para gratinar</li>];[]
https://www.recetasderechupete.com/ensalada-vicen-pollo-alcachofas-y-queso-de-cabra/2066/;Ensalada de pollo, alcachofas y queso de cabra;Alfonso López;Fácil;https://www.recetasderechupete.com/wp-content/uploads/2010/07/ensalada_vicen.jpg;;Recetas con pollo · Recetas de ensaladas y verduras;15 min.;4 pers.;Precio: 1.9 €/persona;0;0;[<li>1 bolsa (300 g) con variado de lechugas (escarola rizada, radiccho, mizuna, brotes de lechuga roja y rúcula salvaje)</li>, <li>250 g de alcachofas (Peso escurrido del bote 180 g)</li>, <li>Una loncha gruesa de fiambre de pollo (180 g)</li>, <li>60 g de piñones tostados</li>, <li>30 g de uvas pasas</li>, <li>100 ml de aceite de oliva virgen extra</li>, <li>50 ml de vinagre de Jérez</li>, <li>2 cucharadas de azúcar</li>, <li>150 g de queso de cabra</li>, <li>Sal (al gusto)</li>];[]
https://www.recetasderechupete.com/ensalada-templada-de-pollo-y-bacon/1841/;Ensalada templada de pollo y bacon;Alfonso López;Fácil;https://www.recetasderechupete.com/wp-content/uploads/2010/07/ensalada_templada_pollo_bacon.jpg;;Recetas con pollo · Recetas de carnes y aves · Recetas de ensaladas y verduras;15 min.;4 pers.;Precio: 1.4 €/persona;3.9;8;[<li>300 g. de Bolsa con variado de lechugas (lechuga iceberg, rúcala, canónigos, lollo rosso...)</li>, <li>2 solomillos de pollo (300 g.)</li>, <li>8 rulos de queso de cabra</li>, <li>1 tomate</li>, <li>2 lonchas de bacon</li>, <li>50 ml. de aceite de oliva virgen extra</li>, <li>25 ml. de vinagre de Módena</li>, <li>Sal y pimienta (al gusto)</li>];[]
https://www.recetasderechupete.com/receta-de-fideos-japoneses-udon-noodle-con-pollo-al-curry/509/;Fideos japoneses (Udon Noodle) con pollo al curry;Alfonso López;Fácil;https://www.recetasderechupete.com/wp-content/uploads/2010/05/udon_curry.jpg;;Recetas con fideos · Recetas con pollo · Recetas de carnes y aves · Recetas de pasta · Recetas de pasta con pollo;25 min.;4 pers.;Precio: 1.2 €/persona;3.5;25;[<li>2 cebollas</li>, <li>1/2 pimiento morrón</li>, <li>100 g de brotes de soja</li>, <li>150 g de carne de pechuga de pollo</li>, <li>Sal y pimienta negra recién molida (al gusto)</li>, <li>2 cucharadas de curry</li>, <li>1 paquete de Japanese Noodel (Udon) 800 g</li>, <li>1 diente de ajo</li>, <li>Un poco de jengibre</li>, <li>Setas variadas</li>, <li>Aceite de sésamo (2 cucharadas)</li>, <li>1 cucharada de salsa de soja</li>, <li>1 pimiento verde</li>];[]
